{
  "all_controls_pass": true,
  "claim_boundary": "statistical robustness over finite seeded software simulations; not empirical data, not neural measurement, not clinical evidence, and not a physical qFEP realization",
  "controls": {
    "all_intervals_finite": true,
    "all_pruning_rates_bounded": true,
    "has_stable_sign_cells": true,
    "high_access_not_lower_than_low_access": true
  },
  "row_count": 45,
  "rows": [
    {
      "all_noise_rows_same_sign": true,
      "delta_ci95_high": 0.2294285714285714,
      "delta_ci95_low": 0.1780000000000001,
      "finite_interval": true,
      "grid_delta_max": 0.25,
      "grid_delta_min": 0.15400000000000008,
      "mean_delta_free_energy": 0.20371428571428574,
      "metacognitive_access": 0.0,
      "noise_row_count": 7,
      "prior_precision": 0.2,
      "pruned_noise_rows": 0,
      "pruning_ci95_high": 0.0,
      "pruning_ci95_low": 0.0,
      "pruning_rate": 0.0,
      "sign_stable": true
    },
    {
      "all_noise_rows_same_sign": true,
      "delta_ci95_high": 0.17435714285714282,
      "delta_ci95_low": 0.1274910714285714,
      "finite_interval": true,
      "grid_delta_max": 0.1937499999999999,
      "grid_delta_min": 0.10324999999999995,
      "mean_delta_free_energy": 0.1501160714285714,
      "metacognitive_access": 0.125,
      "noise_row_count": 7,
      "prior_precision": 0.2,
      "pruned_noise_rows": 0,
      "pruning_ci95_high": 0.0,
      "pruning_ci95_low": 0.0,
      "pruning_rate": 0.0,
      "sign_stable": true
    },
    {
      "all_noise_rows_same_sign": true,
      "delta_ci95_high": 0.11928571428571422,
      "delta_ci95_low": 0.07526785714285715,
      "finite_interval": true,
      "grid_delta_max": 0.13749999999999996,
      "grid_delta_min": 0.05250000000000006,
      "mean_delta_free_energy": 0.09651785714285714,
      "metacognitive_access": 0.25,
      "noise_row_count": 7,
      "prior_precision": 0.2,
      "pruned_noise_rows": 0,
      "pruning_ci95_high": 0.0,
      "pruning_ci95_low": 0.0,
      "pruning_rate": 0.0,
      "sign_stable": true
    },
    {
      "all_noise_rows_same_sign": true,
      "delta_ci95_high": 0.06279464285714287,
      "delta_ci95_low": 0.021625000000000026,
      "finite_interval": true,
      "grid_delta_max": 0.08124999999999999,
      "grid_delta_min": 0.0017500000000000293,
      "mean_delta_free_energy": 0.04291964285714286,
      "metacognitive_access": 0.375,
      "noise_row_count": 7,
      "prior_precision": 0.2,
      "pruned_noise_rows": 0,
      "pruning_ci95_high": 0.0,
      "pruning_ci95_low": 0.0,
      "pruning_rate": 0.0,
      "sign_stable": true
    },
    {
      "all_noise_rows_same_sign": false,
      "delta_ci95_high": 0.007821428571428547,
      "delta_ci95_low": -0.031821428571428556,
      "finite_interval": true,
      "grid_delta_max": 0.025000000000000022,
      "grid_delta_min": -0.04899999999999999,
      "mean_delta_free_energy": -0.010678571428571442,
      "metacognitive_access": 0.5,
      "noise_row_count": 7,
      "prior_precision": 0.2,
      "pruned_noise_rows": 4,
      "pruning_ci95_high": 0.8571428571428571,
      "pruning_ci95_low": 0.14285714285714285,
      "pruning_rate": 0.5714285714285714,
      "sign_stable": false
    },
    {
      "all_noise_rows_same_sign": true,
      "delta_ci95_high": -0.04715178571428572,
      "delta_ci95_low": -0.08140178571428569,
      "finite_interval": true,
      "grid_delta_max": -0.031249999999999944,
      "grid_delta_min": -0.09974999999999995,
      "mean_delta_free_energy": -0.0642767857142857,
      "metacognitive_access": 0.625,
      "noise_row_count": 7,
      "prior_precision": 0.2,
      "pruned_noise_rows": 7,
      "pruning_ci95_high": 1.0,
      "pruning_ci95_low": 1.0,
      "pruning_rate": 1.0,
      "sign_stable": true
    },
    {
      "all_noise_rows_same_sign": true,
      "delta_ci95_high": -0.10100000000000002,
      "delta_ci95_low": -0.134103125,
      "finite_interval": true,
      "grid_delta_max": -0.08750000000000008,
      "grid_delta_min": -0.1504999999999999,
      "mean_delta_free_energy": -0.11787499999999998,
      "metacognitive_access": 0.75,
      "noise_row_count": 7,
      "prior_precision": 0.2,
      "pruned_noise_rows": 7,
      "pruning_ci95_high": 1.0,
      "pruning_ci95_low": 1.0,
      "pruning_rate": 1.0,
      "sign_stable": true
    },
    {
      "all_noise_rows_same_sign": true,
      "delta_ci95_high": -0.1566618303571429,
      "delta_ci95_low": -0.18584821428571427,
      "finite_interval": true,
      "grid_delta_max": -0.14375,
      "grid_delta_min": -0.20125000000000004,
      "mean_delta_free_energy": -0.17147321428571427,
      "metacognitive_access": 0.875,
      "noise_row_count": 7,
      "prior_precision": 0.2,
      "pruned_noise_rows": 7,
      "pruning_ci95_high": 1.0,
      "pruning_ci95_low": 1.0,
      "pruning_rate": 1.0,
      "sign_stable": true
    },
    {
      "all_noise_rows_same_sign": true,
      "delta_ci95_high": -0.21114285714285722,
      "delta_ci95_low": -0.2393946428571428,
      "finite_interval": true,
      "grid_delta_max": -0.2,
      "grid_delta_min": -0.25199999999999995,
      "mean_delta_free_energy": -0.2250714285714286,
      "metacognitive_access": 1.0,
      "noise_row_count": 7,
      "prior_precision": 0.2,
      "pruned_noise_rows": 7,
      "pruning_ci95_high": 1.0,
      "pruning_ci95_low": 1.0,
      "pruning_rate": 1.0,
      "sign_stable": true
    },
    {
      "all_noise_rows_same_sign": true,
      "delta_ci95_high": -0.07399999999999997,
      "delta_ci95_low": -0.12028571428571427,
      "finite_interval": true,
      "grid_delta_max": -0.04999999999999995,
      "grid_delta_min": -0.14599999999999996,
      "mean_delta_free_energy": -0.09628571428571424,
      "metacognitive_access": 0.0,
      "noise_row_count": 7,
      "prior_precision": 0.5,
      "pruned_noise_rows": 7,
      "pruning_ci95_high": 1.0,
      "pruning_ci95_low": 1.0,
      "pruning_rate": 1.0,
      "sign_stable": true
    },
    {
      "all_noise_rows_same_sign": true,
      "delta_ci95_high": -0.12887500000000002,
      "delta_ci95_low": -0.17412500000000003,
      "finite_interval": true,
      "grid_delta_max": -0.10625000000000008,
      "grid_delta_min": -0.1967500000000001,
      "mean_delta_free_energy": -0.1498839285714286,
      "metacognitive_access": 0.125,
      "noise_row_count": 7,
      "prior_precision": 0.5,
      "pruned_noise_rows": 7,
      "pruning_ci95_high": 1.0,
      "pruning_ci95_low": 1.0,
      "pruning_rate": 1.0,
      "sign_stable": true
    },
    {
      "all_noise_rows_same_sign": true,
      "delta_ci95_high": -0.1822321428571429,
      "delta_ci95_low": -0.22473214285714288,
      "finite_interval": true,
      "grid_delta_max": -0.16250000000000003,
      "grid_delta_min": -0.2475,
      "mean_delta_free_energy": -0.2034821428571429,
      "metacognitive_access": 0.25,
      "noise_row_count": 7,
      "prior_precision": 0.5,
      "pruned_noise_rows": 7,
      "pruning_ci95_high": 1.0,
      "pruning_ci95_low": 1.0,
      "pruning_rate": 1.0,
      "sign_stable": true
    },
    {
      "all_noise_rows_same_sign": true,
      "delta_ci95_high": -0.23862499999999995,
      "delta_ci95_low": -0.278375,
      "finite_interval": true,
      "grid_delta_max": -0.21875,
      "grid_delta_min": -0.29825,
      "mean_delta_free_energy": -0.25708035714285715,
      "metacognitive_access": 0.375,
      "noise_row_count": 7,
      "prior_precision": 0.5,
      "pruned_noise_rows": 7,
      "pruning_ci95_high": 1.0,
      "pruning_ci95_low": 1.0,
      "pruning_rate": 1.0,
      "sign_stable": true
    },
    {
      "all_noise_rows_same_sign": true,
      "delta_ci95_high": -0.2921785714285714,
      "delta_ci95_low": -0.33182142857142854,
      "finite_interval": true,
      "grid_delta_max": -0.27499999999999997,
      "grid_delta_min": -0.34900000000000003,
      "mean_delta_free_energy": -0.31067857142857147,
      "metacognitive_access": 0.5,
      "noise_row_count": 7,
      "prior_precision": 0.5,
      "pruned_noise_rows": 7,
      "pruning_ci95_high": 1.0,
      "pruning_ci95_low": 1.0,
      "pruning_rate": 1.0,
      "sign_stable": true
    },
    {
      "all_noise_rows_same_sign": true,
      "delta_ci95_high": -0.3466319196428571,
      "delta_ci95_low": -0.3814017857142857,
      "finite_interval": true,
      "grid_delta_max": -0.33124999999999993,
      "grid_delta_min": -0.39975,
      "mean_delta_free_energy": -0.36427678571428573,
      "metacognitive_access": 0.625,
      "noise_row_count": 7,
      "prior_precision": 0.5,
      "pruned_noise_rows": 7,
      "pruning_ci95_high": 1.0,
      "pruning_ci95_low": 1.0,
      "pruning_rate": 1.0,
      "sign_stable": true
    },
    {
      "all_noise_rows_same_sign": true,
      "delta_ci95_high": -0.402125,
      "delta_ci95_low": -0.43522812499999997,
      "finite_interval": true,
      "grid_delta_max": -0.38750000000000007,
      "grid_delta_min": -0.45049999999999996,
      "mean_delta_free_energy": -0.417875,
      "metacognitive_access": 0.75,
      "noise_row_count": 7,
      "prior_precision": 0.5,
      "pruned_noise_rows": 7,
      "pruning_ci95_high": 1.0,
      "pruning_ci95_low": 1.0,
      "pruning_rate": 1.0,
      "sign_stable": true
    },
    {
      "all_noise_rows_same_sign": true,
      "delta_ci95_high": -0.45607142857142857,
      "delta_ci95_low": -0.4848214285714287,
      "finite_interval": true,
      "grid_delta_max": -0.44375,
      "grid_delta_min": -0.5012500000000001,
      "mean_delta_free_energy": -0.47147321428571426,
      "metacognitive_access": 0.875,
      "noise_row_count": 7,
      "prior_precision": 0.5,
      "pruned_noise_rows": 7,
      "pruning_ci95_high": 1.0,
      "pruning_ci95_low": 1.0,
      "pruning_rate": 1.0,
      "sign_stable": true
    },
    {
      "all_noise_rows_same_sign": true,
      "delta_ci95_high": -0.5116767857142858,
      "delta_ci95_low": -0.539,